{
  "corpus_id": "python-tier-a-micro-corpus",
  "kind": "active_roundtrip",
  "split_contract": {
    "mode": "simulated_no_training",
    "train": [],
    "dev": [],
    "test": [
      "fixture.python_importer.a_basic_function",
      "fixture.python_importer.a_async_await",
      "fixture.python_importer.b_direct_call"
    ]
  },
  "fixtures": [
    {
      "id": "fixture.python_importer.a_basic_function",
      "language": "python",
      "path": "tests/python_importer/cases/a_basic_function/source.py",
      "tier": "A",
      "expected_support": "roundtrip",
      "expected_preservation_ceiling": "P1",
      "expected_preservation_stage_behavior": {
        "source_to_h": {
          "status": "pass",
          "preservation_level": "P1"
        },
        "scir_h_validation": {
          "status": "pass",
          "preservation_level": "P1"
        },
        "h_to_l": {
          "status": "pass",
          "preservation_level": "P1"
        },
        "scir_l_validation": {
          "status": "pass",
          "preservation_level": "P1"
        },
        "h_to_python": {
          "status": "pass",
          "preservation_level": "P1"
        },
        "l_to_wasm": {
          "status": "pass",
          "preservation_level": "P2"
        }
      },
      "features": [
        "plain function definition",
        "local reassignment",
        "scalar comparison branch"
      ],
      "hash": "sha256:76bbede61fee10a41d272db0103a2bf2a3f1c80321ce68d34f9517daa3444db9",
      "frontend": "python",
      "split": "test",
      "origin": "checked_in_fixture",
      "sample_class": "real",
      "profiles": [
        "R",
        "D-PY"
      ],
      "pipeline_stages": [
        "source_to_h",
        "scir_h_validation",
        "h_to_l",
        "scir_l_validation",
        "h_to_python",
        "l_to_wasm"
      ],
      "construct_family": "branch-local-mutation",
      "fixture_set": "python-tier-a"
    },
    {
      "id": "fixture.python_importer.a_async_await",
      "language": "python",
      "path": "tests/python_importer/cases/a_async_await/source.py",
      "tier": "A",
      "expected_support": "roundtrip",
      "expected_preservation_ceiling": "P1",
      "expected_preservation_stage_behavior": {
        "source_to_h": {
          "status": "pass",
          "preservation_level": "P1"
        },
        "scir_h_validation": {
          "status": "pass",
          "preservation_level": "P1"
        },
        "h_to_l": {
          "status": "pass",
          "preservation_level": "P1"
        },
        "scir_l_validation": {
          "status": "pass",
          "preservation_level": "P1"
        },
        "h_to_python": {
          "status": "pass",
          "preservation_level": "P1"
        }
      },
      "features": [
        "async function definition",
        "simple await"
      ],
      "hash": "sha256:4839382e2fe849f7c9bb73f91b5ae5603f631f1a54ce42654fcffcc3e0b05a81",
      "frontend": "python",
      "split": "test",
      "origin": "checked_in_fixture",
      "sample_class": "real",
      "profiles": [
        "R",
        "D-PY"
      ],
      "pipeline_stages": [
        "source_to_h",
        "scir_h_validation",
        "h_to_l",
        "scir_l_validation",
        "h_to_python"
      ],
      "construct_family": "async-await",
      "fixture_set": "python-tier-a"
    },
    {
      "id": "fixture.python_importer.b_direct_call",
      "language": "python",
      "path": "tests/python_importer/cases/b_direct_call/source.py",
      "tier": "A",
      "expected_support": "roundtrip",
      "expected_preservation_ceiling": "P1",
      "expected_preservation_stage_behavior": {
        "source_to_h": {
          "status": "pass",
          "preservation_level": "P1"
        },
        "scir_h_validation": {
          "status": "pass",
          "preservation_level": "P1"
        },
        "h_to_l": {
          "status": "pass",
          "preservation_level": "P1"
        },
        "scir_l_validation": {
          "status": "pass",
          "preservation_level": "P1"
        },
        "h_to_python": {
          "status": "pass",
          "preservation_level": "P1"
        },
        "l_to_wasm": {
          "status": "pass",
          "preservation_level": "P2"
        }
      },
      "features": [
        "direct local call preservation"
      ],
      "hash": "sha256:7c8b1278249b744e952884d637f158e7c5f2ae69b594f4c5ec2386f811d6bd54",
      "frontend": "python",
      "split": "test",
      "origin": "checked_in_fixture",
      "sample_class": "real",
      "profiles": [
        "R",
        "D-PY"
      ],
      "pipeline_stages": [
        "source_to_h",
        "scir_h_validation",
        "h_to_l",
        "scir_l_validation",
        "h_to_python",
        "l_to_wasm"
      ],
      "construct_family": "direct-call",
      "fixture_set": "python-tier-a"
    }
  ]
}
